{
  "name": "minecraft-configuration",
  "version": "1.0.0",
  "description": "Add or migrate Minecraft plugin/mod configuration, catalogs, probability tables and feature flags safely.",
  "category": "data",
  "supports": {
    "editions": [
      "java",
      "bedrock"
    ],
    "platforms": [],
    "verified_versions": [],
    "policy": "resolve-exact-target"
  },
  "requires": {
    "context": [
      "edition",
      "minecraft",
      "platform"
    ],
    "java": null
  },
  "inputs": [
    "project_context",
    "task"
  ],
  "outputs": [
    "changed_artifacts",
    "verification_report"
  ],
  "validation": [
    "contract",
    "references",
    "target-api-or-format",
    "relevant-build-or-runtime"
  ],
  "sources": [
    "config",
    "database"
  ]
}
