{
  "name": "minecraft-dependency-detection",
  "version": "1.0.0",
  "description": "Resolve installed dependencies, pinned API artifacts and build-tool compatibility without speculative additions.",
  "category": "core",
  "supports": {
    "editions": [
      "java",
      "bedrock"
    ],
    "platforms": [],
    "verified_versions": [],
    "policy": "resolve-exact-target"
  },
  "requires": {
    "context": [
      "edition",
      "minecraft",
      "platform"
    ],
    "java": null
  },
  "inputs": [
    "project_context",
    "task"
  ],
  "outputs": [
    "changed_artifacts",
    "verification_report"
  ],
  "validation": [
    "contract",
    "references",
    "target-api-or-format",
    "relevant-build-or-runtime"
  ],
  "sources": [
    "paper-setup",
    "fabric",
    "neoforge"
  ]
}
