{
  "name": "minecraft-quests",
  "version": "1.0.0",
  "description": "Implement optional objectives and quest state with idempotent completion and recovery.",
  "category": "gameplay/quests",
  "supports": {
    "editions": [
      "java",
      "bedrock"
    ],
    "platforms": [],
    "verified_versions": [],
    "policy": "resolve-exact-target"
  },
  "requires": {
    "context": [
      "edition",
      "minecraft",
      "platform"
    ],
    "java": null
  },
  "inputs": [
    "project_context",
    "task"
  ],
  "outputs": [
    "rules_or_source",
    "state_and_recovery_plan",
    "verification_report"
  ],
  "validation": [
    "contract",
    "references",
    "rules-invariants",
    "multiplayer-authority",
    "duplication-and-recovery",
    "relevant-runtime"
  ],
  "sources": [
    "pdc",
    "paper-setup"
  ]
}
