{
  "name": "minecraft-network-payloads",
  "version": "1.0.0",
  "description": "Design or debug Fabric/NeoForge custom network payloads, menu synchronization and validated client requests.",
  "category": "modding",
  "supports": {
    "editions": [
      "java",
      "bedrock"
    ],
    "platforms": [],
    "verified_versions": [],
    "policy": "resolve-exact-target"
  },
  "requires": {
    "context": [
      "edition",
      "minecraft",
      "platform"
    ],
    "java": null
  },
  "inputs": [
    "project_context",
    "task"
  ],
  "outputs": [
    "changed_artifacts",
    "verification_report"
  ],
  "validation": [
    "contract",
    "references",
    "target-api-or-format",
    "relevant-build-or-runtime"
  ],
  "sources": [
    "fabric-net",
    "neoforge-net"
  ]
}
