{
  "name": "minecraft-subagents",
  "version": "1.0.0",
  "description": "Coordinate authorized Minecraft subagent research, implementation or review with bounded tasks, separate edit ownership and parent verification.",
  "category": "automation",
  "supports": {
    "editions": [
      "java",
      "bedrock"
    ],
    "platforms": [],
    "verified_versions": [],
    "policy": "resolve-exact-target"
  },
  "requires": {
    "context": [
      "edition",
      "minecraft",
      "platform"
    ],
    "java": null
  },
  "inputs": [
    "project_context",
    "task"
  ],
  "outputs": [
    "changed_artifacts",
    "verification_report"
  ],
  "validation": [
    "contract",
    "references",
    "target-api-or-format",
    "relevant-build-or-runtime"
  ],
  "sources": [
    "agent-skills"
  ]
}
