{
  "name": "minecraft-bitmap-fonts",
  "version": "1.0.0",
  "description": "Create resource-pack font glyphs, custom GUI panels, icons or debug glyph advances, clipping and clickable text bounds.",
  "category": "resourcepack",
  "supports": {
    "editions": [
      "java"
    ],
    "platforms": [],
    "verified_versions": [],
    "policy": "resolve-exact-target"
  },
  "requires": {
    "context": [
      "edition",
      "minecraft",
      "platform"
    ],
    "java": null
  },
  "inputs": [
    "project_context",
    "task"
  ],
  "outputs": [
    "namespaced_assets_or_data",
    "pack_metadata",
    "verification_report"
  ],
  "validation": [
    "contract",
    "references",
    "exact-format",
    "parse-and-readback",
    "matching-runtime-reload",
    "relevant-client-render"
  ],
  "sources": [
    "dialog",
    "release-1219",
    "text-access"
  ]
}
