{
  "name": "minecraft-teams-social",
  "version": "1.0.0",
  "description": "Build Minecraft parties, teams, guilds, cooperative ownership and role changes with authoritative membership and scoped access.",
  "category": "gameplay",
  "supports": {
    "editions": [
      "java",
      "bedrock"
    ],
    "platforms": [],
    "verified_versions": [],
    "policy": "resolve-exact-target"
  },
  "requires": {
    "context": [
      "edition",
      "minecraft",
      "platform"
    ],
    "java": null
  },
  "inputs": [
    "project_context",
    "task"
  ],
  "outputs": [
    "rules_or_source",
    "state_and_recovery_plan",
    "verification_report"
  ],
  "validation": [
    "contract",
    "references",
    "rules-invariants",
    "multiplayer-authority",
    "duplication-and-recovery",
    "relevant-runtime"
  ],
  "sources": [
    "team",
    "luckperms",
    "worldguard",
    "database",
    "minimessage"
  ]
}
