{
  "name": "minecraft-testing",
  "version": "1.0.0",
  "description": "Test Minecraft plugin/mod/data changes with pure checks, matching isolated runtimes and real-client validation where needed.",
  "category": "testing",
  "supports": {
    "editions": [
      "java",
      "bedrock"
    ],
    "platforms": [],
    "verified_versions": [],
    "policy": "resolve-exact-target"
  },
  "requires": {
    "context": [
      "edition",
      "minecraft",
      "platform"
    ],
    "java": null
  },
  "inputs": [
    "project_context",
    "task"
  ],
  "outputs": [
    "changed_artifacts",
    "verification_report"
  ],
  "validation": [
    "contract",
    "references",
    "target-api-or-format",
    "relevant-build-or-runtime"
  ],
  "sources": [
    "mockbukkit",
    "paper-start",
    "dialog"
  ]
}
