{
  "name": "minecraft-crafting-automation",
  "version": "1.0.0",
  "description": "Implement or debug Minecraft crafting, redstone interactions, processing queues and storage logistics using native mechanics where possible.",
  "category": "gameplay",
  "supports": {
    "editions": [
      "java",
      "bedrock"
    ],
    "platforms": [],
    "verified_versions": [],
    "policy": "resolve-exact-target"
  },
  "requires": {
    "context": [
      "edition",
      "minecraft",
      "platform"
    ],
    "java": null
  },
  "inputs": [
    "project_context",
    "task"
  ],
  "outputs": [
    "rules_or_source",
    "state_and_recovery_plan",
    "verification_report"
  ],
  "validation": [
    "contract",
    "references",
    "rules-invariants",
    "multiplayer-authority",
    "duplication-and-recovery",
    "relevant-runtime"
  ],
  "sources": [
    "recipes",
    "redstone",
    "paper-vanilla",
    "scheduler",
    "database",
    "create"
  ]
}
