{
  "name": "minecraft-performance",
  "version": "1.0.0",
  "description": "Diagnose Minecraft tick lag, memory growth or plugin throughput using reproducible profiling and bounded workload design.",
  "category": "debugging",
  "supports": {
    "editions": [
      "java",
      "bedrock"
    ],
    "platforms": [],
    "verified_versions": [],
    "policy": "resolve-exact-target"
  },
  "requires": {
    "context": [
      "edition",
      "minecraft",
      "platform"
    ],
    "java": null
  },
  "inputs": [
    "project_context",
    "task"
  ],
  "outputs": [
    "changed_artifacts",
    "verification_report"
  ],
  "validation": [
    "contract",
    "references",
    "target-api-or-format",
    "relevant-build-or-runtime"
  ],
  "sources": [
    "profile",
    "scheduler",
    "folia"
  ]
}
