{
  "name": "minecraft-movement-abilities",
  "version": "1.0.0",
  "description": "Implement Minecraft parkour, checkpoints, dashes, flight, mounts, teleportation and cooldown abilities with server-authoritative rules.",
  "category": "gameplay",
  "supports": {
    "editions": [
      "java",
      "bedrock"
    ],
    "platforms": [],
    "verified_versions": [],
    "policy": "resolve-exact-target"
  },
  "requires": {
    "context": [
      "edition",
      "minecraft",
      "platform"
    ],
    "java": null
  },
  "inputs": [
    "project_context",
    "task"
  ],
  "outputs": [
    "rules_or_source",
    "state_and_recovery_plan",
    "verification_report"
  ],
  "validation": [
    "contract",
    "references",
    "rules-invariants",
    "multiplayer-authority",
    "duplication-and-recovery",
    "relevant-runtime"
  ],
  "sources": [
    "teleport",
    "scheduler",
    "worldguard",
    "fabric-attributes",
    "neoforge-attributes"
  ]
}
